7174,"Altered State of Consciousness and Mental Imagery as a Function of N, N-dimethyltryptamine Concentration in Ritualistic Ayahuasca Users.^
Consumption of the psychedelic brew ayahuasca is a central ritualistic aspect of the Santo Daime religion. The current observational, baseline controlled study was designed to assess whether members (n = 24) of the Santo Daime church would show enhanced capacity for mental imagery during an ayahuasca experience. In addition, this study assessed whether the effects of ayahuasca on consciousness and mental imagery were related to peak serum concentration of N, N-dimethyltryptamine (DMT), the main psychoactive component. Measures of altered states of consciousness (5-Dimensional Altered States of Consciousness Questionnaire) and ego dissolution (Ego Dissolution Inventory [EDI]) as well as measures of mental imagery (visual perspective shifting, vividness of visual imagery, cognitive flexibility, associative thinking) were taken on two subsequent days on which members of Santo Daime were sober or drank a self-selected volume of ayahuasca. Measures of altered states of consciousness revealed that feelings of oceanic boundlessness, visual restructuralization, and EDI increased most prominently after drinking and shared a positive correlation with peak DMT concentration. Measures of mental imagery did not noticeably differ between the baseline and ayahuasca condition, although subjective ratings of cognitive flexibility were lower under ayahuasca. Two measures related to mental imagery, that is, perspective shifts and cognitive flexibility, were significantly correlated to peak DMT concentrations. Peak concentrations of DMT and other alkaloids did not correlate with ayahuasca dose. These findings confirm previous notions that the primary phenomenological characteristics of ayahuasca are driven by DMT. Compensatory or neuroadaptive effects associated with long-term ayahuasca intake may have mitigated the acute impact of ayahuasca in Santo Daime members on mental imagery.",0,0,0,0,0,0,0,0,0,0,0,0,0,0,0,0,0,0,0,0,0,0,0,0,0,0,0,0,0,0,0,0,0,0,0,0,0,0,0,0,0,0,0,0,0,0,0,0,0,0,0,0,0,0,0,0,0,0,0,0,0,0,1,1,0,0,0,0,0,0,0,1,1,1,0,0,0,0,0,0,0,0,0,1,0,0,0,0,0,1,0,0,0,0,0,0,0,0,0,0,0,0,0,0,0,0,0,0,0,0,0,0,0,0,0,0,0,0,0,0,0,0,0,0,0,0,0,0
7190,"Attenuation of ketamine-induced impairment in verbal learning and memory in healthy volunteers by the AMPA receptor potentiator PF-04958242.^
There is a need to develop treatments for cognitive impairment associated with schizophrenia (CIAS). The significant role played by N-methyl-D-aspartate receptors (NMDARs) in both the pathophysiology of schizophrenia and in neuronal plasticity suggests that facilitation of NMDAR function might ameliorate CIAS. One strategy to correct NMDAR hypofunction is to stimulate α-amino-3- hydroxy-5-methyl-4-isoxazolepropionic acid receptors (AMPARs) as AMPAR and NMDAR functioning are coupled and interdependent. In rats and nonhuman primates (NHP), AMPAR potentiators reduce spatial working memory deficits caused by the nonselective NMDAR antagonist ketamine. The current study assessed whether the AMPAR potentiator PF-04958242 would attenuate ketamine-induced deficits in verbal learning and memory in humans. Healthy male subjects (n = 29) participated in two randomized treatment periods of daily placebo or PF-04958242 for 5 days separated by a washout period. On day 5 of each treatment period, subjects underwent a ketamine infusion for 75 min during which the effects of PF-04958242/placebo were assessed on ketamine-induced: (1) impairments in verbal learning and recall measured by the Hopkins Verbal Learning Test; (2) impairments in working memory on a CogState battery; and (3) psychotomimetic effects measured by the Positive and Negative Syndrome Scale and Clinician-Administered Dissociative Symptoms Scale. PF-04958242 significantly reduced ketamine-induced impairments in immediate recall and the 2-Back and spatial working memory tasks (CogState Battery), without significantly attenuating ketamine-induced psychotomimetic effects. There were no pharmacokinetic interactions between PF-04958242 and ketamine. Furthermore, PF-04958242 was well tolerated. ‘High-impact’ AMPAR potentiators like PF-04958242 may have a role in the treatment of the cognitive symptoms, but not the positive or negative symptoms, associated with schizophrenia. The excellent concordance between the preclinical (rat, NHP) and human studies with PF-04958242, and in silico modeling of AMPAR–NMDAR interactions in the hippocampus, highlights the translational value of this study. (PsycINFO Database Record (c) 2018 APA, all rights reserved)",0,0,0,0,0,0,0,0,0,0,0,0,0,0,0,0,0,0,0,0,0,0,0,0,0,0,0,0,0,0,0,0,0,0,0,0,0,0,0,0,0,0,0,0,0,0,0,0,0,0,0,0,0,0,0,0,0,0,0,0,0,0,0,1,0,0,0,0,0,0,0,1,0,0,0,0,0,0,0,0,0,0,0,1,0,0,0,0,0,1,0,0,0,0,0,0,0,0,0,0,0,0,0,0,0,0,0,0,0,0,0,0,0,0,0,0,0,0,0,0,0,0,0,0,0,0,0,0
7860,"Debunking the myth of 'Blue Mondays': No evidence of affect drop after taking clinical MDMA.^
BACKGROUND: Incorporating 3,4-methylenedioxymethamphetamine (MDMA) as an adjunct to psychotherapy has shown promise in recent years for treating various mental health conditions, particularly those involving trauma. However, concerns about declines in mood and cognition during the days following dosing, also known as 'Blue Mondays', have been raised as limitations to its clinical use. Although these changes have been well-documented among recreational users, there are critical confounds to these reports that limit generalizability to clinically administered MDMA. AIMS: Here, we aimed to evaluate the evidence basis for the negative side effects associated with MDMA as well as inform our understanding of the drug's post-acute effects in a clinical context with an open-label study. METHODS: The current open-label study examined MDMA therapy for alcohol use disorder (AUD; N = 14) and measured mood, sleep quality, illicit MDMA consumption and anecdotal reports after the acute drug effects had worn off. RESULTS: Participants maintained a positive mood during the week following drug administration in a clinical context. Relative to baseline, self-reported sleep quality improved at the 3- and 6-month follow-ups. Finally, no participants reported using or desiring to use illicit MDMA, and the anecdotal reports indicated that they perceived the treatment favourably. CONCLUSION: The results support the overall safety and tolerability of clinically administered MDMA and, importantly, suggest that the 'come downs' previously associated with the substance may be explained by confounds in research relating to the illicit sourcing of the drug and specific environmental setting for recreational consumption.",0,0,0,0,0,0,0,0,0,0,0,0,0,0,0,0,0,0,0,0,0,0,0,0,0,0,0,0,0,0,0,0,0,0,0,0,0,0,0,0,0,0,0,0,0,0,0,0,0,0,1,0,0,0,1,0,0,0,0,0,0,0,0,0,0,0,0,0,0,0,0,1,0,0,0,0,0,0,0,0,0,0,1,0,1,0,0,0,0,0,0,0,0,0,0,0,0,0,0,0,0,0,0,0,0,0,0,0,0,0,0,0,0,0,0,0,0,0,0,0,0,0,0,0,0,0,0,0
8596,"Mood and impulsivity of recreational Ecstasy users in the week following a ""rave"".^
Two days following widely attended ""rave"" or dance party events, questionnaires assessing mood (Beck Depression Inventory, or BDI-II) and impulsivity (Impulsiveness, Venturesomeness and Empathy Scale, or IVE) were completed by 43 attendees who reported using Ecstasy at the events, and by 31 Ecstasy-naïve controls who attended the same events. Participants who had taken Ecstasy at the events were significantly more depressed two days later than controls, according to analysis of their BDI-II scores. There was no group difference in impulsivity as measured by the IVE. Levels of self-reported Ecstasy use were not related to depression or impulsivity scores. Results are considered in terms of the hypothetical mood effect of short-term depletion of serotonin induced by MDMA, as well as several alternative non-pharmacological explanations.",0,0,0,0,0,0,0,0,0,0,0,0,0,0,0,0,0,0,0,0,0,0,0,0,0,0,0,0,0,0,0,0,0,0,0,0,0,0,0,0,0,0,0,0,0,0,0,0,0,0,0,0,0,0,0,0,0,0,0,0,0,0,1,1,0,0,0,0,0,0,0,0,0,0,1,0,0,0,0,0,0,0,0,1,0,0,0,0,0,1,0,0,0,0,0,0,0,0,0,0,0,0,0,0,0,0,0,0,0,0,0,0,0,0,0,0,0,0,0,0,0,0,0,0,0,0,0,0
8606,"Anxiolytic effects of acute and maintenance ketamine, as assessed by the Fear Questionnaire subscales and the Spielberger State Anxiety Rating Scale.^
BACKGROUND: Ketamine has rapid anxiolytic effects in treatment-resistant obsessive compulsive, post-traumatic stress, generalised anxiety and social anxiety disorders. OBJECTIVES: This study aimed to assess changes following acute and maintenance ketamine therapy on the Fear Questionnaire (FQ) subscales and the Spielberger State Anxiety Inventory (SSAI). METHODS: This secondary analysis used data from a mixed open-label and double-blinded placebo-controlled study. A total of 24 patients received short-term ascending subcutaneous doses of ketamine and were then eligible to enter a 3-month maintenance phase of 1 mg/kg ketamine dosed once or twice weekly. FQ and SSAI data were analysed using mixed models to identify between-dose differences and to describe trends during maintenance. RESULTS: Acute ketamine dosing showed a rapid dose-related reduction in all three FQ subscales (agoraphobia, social phobia and blood-injury phobia) and in the SSAI. A progressive decrease in pre-dose rating-scale scores was evident during the 3 months of maintenance therapy. CONCLUSIONS: Ketamine demonstrated dose-related improvements in all FQ subscales and in the SSAI. Both scales appear to be suitable tools to assess the anxiolytic effects of ketamine in patients with treatment-resistant anxiety. Furthermore, ketamine appears to have broad, dose-related anti-phobic effects. These findings raise the possibility that ketamine may have therapeutic potential in the treatment of other phobic states, such as specific phobia.",0,0,0,0,0,0,0,0,0,0,0,0,0,0,0,0,0,0,0,0,0,0,0,0,0,0,0,0,0,0,0,0,0,0,0,0,0,0,0,0,0,0,0,0,0,0,0,0,0,0,1,0,1,0,0,0,0,0,0,0,0,0,0,0,0,0,0,0,0,0,0,1,0,0,0,0,0,0,0,0,0,0,1,0,1,0,0,0,0,0,0,0,0,0,0,0,0,0,0,0,0,0,0,0,0,0,0,0,0,0,0,0,0,0,0,0,0,0,0,0,0,0,0,0,0,0,0,0
8889,"Acute effects of intravenous DMT in a randomized placebo-controlled study in healthy participants.^
N,N-dimethyltryptamine (DMT) is distinct among classic serotonergic psychedelics because of its short-lasting effects when administered intravenously. Despite growing interest in the experimental and therapeutic use of intravenous DMT, data are lacking on its clinical pharmacology. We conducted a double-blind, randomized, placebo-controlled crossover trial in 27 healthy participants to test different intravenous DMT administration regimens: placebo, low infusion (0.6 mg/min), high infusion (1 mg/min), low bolus + low infusion (15 mg + 0.6 mg/min), and high bolus + high infusion (25 mg + 1 mg/min). Study sessions lasted for 5 h and were separated by at least 1 week. Participant's lifetime use of psychedelics was ≤20 times. Outcome measures included subjective, autonomic, and adverse effects, pharmacokinetics of DMT, and plasma levels of brain-derived neurotropic factor (BDNF) and oxytocin. Low (15 mg) and high (25 mg) DMT bolus doses rapidly induced very intense psychedelic effects that peaked within 2 min. DMT infusions (0.6 or 1 mg/min) without a bolus induced slowly increasing and dose-dependent psychedelic effects that reached plateaus after 30 min. Both bolus doses produced more negative subjective effects and anxiety than infusions. After stopping the infusion, all drug effects rapidly decreased and completely subsided within 15 min, consistent with a short early plasma elimination half-life (t(1/2α)) of 5.0-5.8 min, followed by longer late elimination (t(1/2β) = 14-16 min) after 15-20 min. Subjective effects of DMT were stable from 30 to 90 min, despite further increasing plasma concentrations, thus indicating acute tolerance to continuous DMT administration. Intravenous DMT, particularly when administered as an infusion, is a promising tool for the controlled induction of a psychedelic state that can be tailored to the specific needs of patients and therapeutic sessions.Trial registration: ClinicalTrials.gov identifier: NCT04353024.",0,0,0,0,0,0,0,0,0,0,0,0,0,0,0,0,0,0,0,0,0,0,0,0,0,0,0,0,0,0,0,0,0,0,0,0,0,0,0,0,0,0,0,0,0,0,0,0,0,0,0,0,0,0,0,0,0,0,0,0,0,0,0,1,0,0,0,0,0,1,0,1,1,1,0,0,0,0,0,0,0,0,1,0,0,0,0,1,0,0,0,0,0,0,0,0,0,0,0,0,0,0,0,0,0,0,0,0,0,0,0,0,0,0,0,0,0,0,0,0,0,0,0,0,0,0,0,0
9175,"Cognitive Behavioral Therapy to Sustain the Antidepressant Effects of Ketamine in Treatment-Resistant Depression: A Randomized Clinical Trial.^
INTRODUCTION: Ketamine has emerged as a rapid-acting antidepressant. While ongoing treatment can prevent relapse, concerns exist regarding long-term exposure. OBJECTIVE: We conducted a randomized trial to examine the feasibility and efficacy of cognitive behavioral therapy (CBT) following intravenous ketamine in treatment-resistant depression (TRD). METHODS: Subjects with TRD were recruited and treated with 6 intravenous infusions of ketamine over 3 weeks. Subjects who experienced a clinical response (≥50% improvement in depression severity) were then randomized to receiving CBT or treatment as usual (TAU) for an additional 14 weeks, using a sequential treatment model. RESULTS: Of the 42 patients who signed consent, 28 patients achieved a response and were randomized to CBT or TAU. When measured using the Montgomery-Asberg Depression Rating Scale (primary outcome measure), the effect size at the end of the study was moderate (Cohen d = 0.65; 95% CI -0.55 to 1.82), though the group-by-time interaction effect was not significant. There was a significant group-by-time interaction as measured by the Quick Inventory of Depressive Symptomatology (F = 4.58; p = 0.033), favoring a greater sustained improvement in the CBT group. This corresponded to a moderate-to-large effect size of the Cohen d = 0.71 (95% CI -0.30 to 1.70) at the end of the study (14 weeks following the last ketamine infusion). In a subset of patients (N = 20) who underwent cognitive testing using the emotional N-back assessments before and after ketamine, ketamine responders showed improvement in the accuracy of emotional N-back (t[8] = 2.33; p < 0.05) whereas nonresponders did not (t[10] <1; p ns). CONCLUSIONS: This proof-of-concept study provides preliminary data indicating that CBT may sustain the antidepressant effects of ketamine in TRD. Further study and optimization of this treatment approach in well-powered clinical trials is recommended.",0,0,0,0,0,0,0,0,0,0,0,0,0,0,0,0,0,0,0,0,0,0,0,0,0,0,0,0,0,0,0,0,0,0,0,0,0,0,0,0,0,0,0,0,0,0,0,0,0,0,1,1,0,0,0,0,0,0,0,0,0,0,0,0,0,0,0,0,0,0,0,1,0,0,0,0,0,0,0,0,0,0,1,0,1,0,0,0,0,0,0,0,0,0,0,0,0,0,0,0,0,0,0,0,0,0,0,0,0,0,0,0,0,0,0,0,0,0,0,0,0,0,0,0,0,0,0,0
