2783,"MDMA Increases Cooperation and Recruitment of Social Brain Areas When Playing Trustworthy Players in an Iterated Prisoner's Dilemma.^
Social decision-making is fundamental for successful functioning and can be affected in psychiatric illness and by serotoninergic modulation. The Prisoner's Dilemma is the archetypal paradigm to model cooperation and trust. However, the effect of serotonergic enhancement is poorly characterized, and its influence on the effect of variations in opponent behavior unknown. To address this, we conducted a study investigating how the serotonergic enhancer 3,4-methylenedioxy-methamphetamine (MDMA) modulates behavior and its neural correlates during an iterated Prisoner's Dilemma with both trustworthy and untrustworthy opponents. We administered 100 mg MDMA or placebo to 20 male participants in a double-blind, placebo-controlled, crossover study. While being scanned, participants played repeated rounds with opponents who differed in levels of cooperation. On each round, participants chose to compete or cooperate and were asked to rate their trust in the other player. Cooperation with trustworthy, but not untrustworthy, opponents was enhanced following MDMA but not placebo (respectively: odds ratio = 2.01; 95% CI, 1.42-2.84, p < 0.001; odds ratio = 1.37; 95% CI, 0.78-2.30, not significant). Specifically, MDMA enhanced recovery from, but not the impact of, breaches in cooperation. During trial outcome, MDMA increased activation of four clusters incorporating precentral and supramarginal gyri, superior temporal cortex, central operculum/posterior insula, and supplementary motor area. There was a treatment × opponent interaction in right anterior insula and dorsal caudate. Trust ratings did not change across treatment sessions. MDMA increased cooperative behavior when playing trustworthy opponents. Underlying this was a change in brain activity of regions linked to social cognition. Our findings highlight the context-specific nature of MDMA's effect on social decision-making.SIGNIFICANCE STATEMENT We provide a detailed analysis of the effect of 3,4-methylenedioxy-methamphetamine (MDMA) on cooperative behavior during interpersonal interactions, as well as the neural correlates underlying these effects. We find that, following administration of MDMA, participants behave more cooperatively, but only when interacting with trustworthy partners. While breaches of trustworthy behavior have a similar impact following administration of MDMA compared with placebo, MDMA facilitates a greater recovery from these breaches of trust. Underlying this altered behavior are changes in brain activity during the viewing of opponents' behavior in regions whose involvement in social processing is well established. This work provides new insights into the impact of MDMA on social interactions, emphasizing the important role of the behavior of others toward us.",0,0,0,0,0,0,0,0,0,0,0,0,0,0,0,0,0,0,0,0,0,0,0,0,0,0,0,0,0,0,0,0,0,0,0,0,0,0,0,0,0,0,0,0,0,0,0,0,0,0,0,0,0,0,0,0,0,0,0,0,0,0,0,1,0,0,1,1,0,0,0,1,0,0,0,0,0,0,0,0,0,0,0,1,0,0,0,0,0,1,0,0,0,0,0,0,0,0,0,0,0,0,0,0,0,0,0,0,0,0,0,0,0,0,0,0,0,0,0,0,0,0,0,0,0,0,0,0
2832,"Is ecstasy perceived to be safe? A critical survey.^
Recent publications claim that the recreational drug ecstasy is considered to be safe by many or most ecstasy users, or by young people or the general public. Unfortunately, there are no references that provide any support for this claim. Previous studies of various populations, including drug users and adolescents in several nations, also failed to support claims of the perceived safety of ecstasy. Epidemiological surveys from the USA and UK consistently report high proportions of young people who perceive great risk in using ecstasy. Studies in ecstasy users show that they are aware of a number of short- and long-term risks of ecstasy use, although, in the absence of actual problems, they evaluate the personal significance of these risks as low. This study further investigated the perceived harmfulness of ecstasy, drawing on an online survey of over 900 drug users. Little support for the claim was found. Seventy-three percent of the participants in the online survey viewed ecstasy as carrying at least 'some risk'. The claim of ecstasy's perceived safety is plausibly based on researchers' assumptions that the continued widespread use of the drug indicates that users are unaware of the associated risks, and that informing them about these risks would lead to a reduction in drug use. We argue that these assumptions are inadequate and that drug information and harm reduction strategies should focus on more affective and personally significant aspects of risk perception. © 2004 Elsevier Ireland Ltd. All rights reserved.",0,0,0,0,0,0,0,0,0,0,0,0,0,0,0,0,0,0,0,0,0,0,0,0,0,0,0,0,0,0,0,0,0,0,0,0,0,0,0,0,0,0,0,0,0,0,0,0,0,0,0,0,0,0,0,0,0,0,0,0,0,0,1,1,0,0,0,0,0,0,0,0,0,0,1,0,0,0,0,0,0,0,0,1,0,0,0,0,0,1,0,0,0,0,0,0,0,0,0,0,0,0,0,0,0,0,0,0,0,0,0,0,0,0,0,0,0,0,0,0,0,0,0,0,0,0,0,0
3104,"Neurometabolic effects of psilocybin, 3,4-methylenedioxyethylamphetamine (MDE) and d-methamphetamine in healthy volunteers. A double-blind, placebo-controlled PET study with [18F]FDG.^
The neurometabolic effects of the hallucinogen psilocybin (PSI; 0.2 mg/kg), the entactogen 3,4-methylenedioxyethylamphetamine (MDE; 2 mg/kg) and the stimulant d-methamphetamine (METH; 0.2-0.4 mg/kg) and the drugs' interactions with a prefrontal activation task were investigated in a double-blind, placebo-controlled human [F-18]fluorodeoxyglucoseFDG-positron emission tomographicPET study (each group: n = 8). Subjects underwent two scans (control: word repetition; activation word association) within 2-4 weeks. Psilocybin increased rMRGlu in distinct right hemispheric frontotemporal cortical regions, particularly in the anterior cingulate and decreased rMRGlu in the thalamus. Both MDE and METH induced cortical hypometabolism and cerebellar hypermetabolism. In the MDE group, cortical hypometabolism was more pronounced in frontal regions, with the exception of the right anterior cingulate, which tended to be hyperactive. Cognitive activation-related increases in left frontocortical regions were attenuated under all three psychoactive substances, but less so under MDE. Taking into account performance data and subjective reports on task difficulty, these effects may result from different mechanisms across the three groups. Our PSI data are in line with studies on acute schizophrenic patients suggesting frontal overactivity at rest, but diminished capacity to activate prefrontal regions upon cognitive demand. The MDE data support the hypothesis that entactogens constitute a distinct psychoactive substance class, which takes an intermediate position between stimulants and hallucinogens.",0,0,0,0,0,0,0,0,0,0,0,0,0,0,0,0,0,0,0,0,0,0,0,0,0,0,0,0,0,0,0,0,0,0,0,0,0,0,0,0,0,0,0,0,0,0,0,0,0,0,0,0,0,0,0,0,0,0,0,0,0,0,0,1,0,0,0,0,1,0,0,0,0,0,0,0,0,0,0,0,0,0,0,1,0,0,0,0,0,1,0,0,0,0,0,0,0,0,0,0,0,0,0,0,0,0,0,0,0,0,0,0,0,0,0,0,0,0,0,0,0,0,0,0,0,0,0,0
3371,"The effects of sub-anaesthetic doses of ketamine on memory, cognitive performance and subjective experience in healthy volunteers.^
Examined cognitive and subjective effects of subanesthetic doses of ketamine on 12 healthy volunteers. Ss received 25 mg ketamine, 10 mg ketamine and saline placebo, intramuscular/ly (im) in a double-blind, Latin square design. A cognitive, perceptual and self-report test battery was administered over 45 min. The order of tests was rotated to control for timing effects. Ketamine (25 mg) significantly affected verbal learning and memory, parallel visual search, some measures of psychomotor performance, measures of arousal, subjective mood ratings and visual perception. Measures of attention and frontal lobe functioning were relatively unaffected. Thus, low doses of ketamine had selective, dose-related effects on memory, perceptual and psychomotor functions. The disruption of memory and perceptual processes may help to explain the unique subjective state induced by ketamine. (PsycINFO Database Record (c) 2016 APA, all rights reserved)",0,0,0,0,0,0,0,0,0,0,0,0,0,0,0,0,0,0,0,0,0,0,0,0,0,0,0,0,0,0,0,0,0,0,0,0,0,0,0,0,0,0,0,0,0,0,0,0,0,0,0,0,0,0,0,0,0,0,0,0,0,0,0,1,0,0,0,0,0,0,0,1,0,0,0,0,0,0,0,0,0,0,0,1,0,0,0,0,0,1,0,0,0,0,0,0,0,0,0,0,0,0,0,0,0,0,0,0,0,0,0,0,0,0,0,0,0,0,0,0,0,0,0,0,0,0,0,0
3537,"Gray matter volume of rostral anterior cingulate cortex predicts rapid antidepressant response to ketamine.^
Ketamine was recently approved for treatment resistant depression. However, despite its therapeutic potential, about 50% of patients do not show improvement under this therapy. In this prospective two-site study, we investigated baseline brain structural predictors for rapid symptom improvement after a single subanesthetic ketamine infusion. Furthermore, given the preclinical evidence and findings from a pilot study in a clinical population that ketamine induces rapid neuroplasticity, we performed an exploratory investigation of macroscopic changes 24 h post-treatment. T1-weighted MRI brain images from 33 depressed patients were acquired before and 24 h after a single ketamine infusion and analyzed using voxel-based morphometry (VBM). Additionally, we performed a region of interest (ROI)-based analysis of structures that have previously been shown to play a role in the antidepressant effects of ketamine: bilateral hippocampus, nucleus accumbens, anterior cingulate cortex, and thalamus. A whole-brain regression analysis showed that greater baseline volume of the bilateral rostral anterior cingulate cortex (rACC) significantly predicts rapid symptom reduction. The right ACC showed the same association in the ROI analysis, while the other regions yielded no significant results. Exploratory follow-up analyses revealed no volumetric changes 24 h after treatment. This is the first study reporting an association between pretreatment gray matter volume of the bilateral rACC and the rapid antidepressant effects of ketamine. Results are in line with previous investigations, which highlighted the potential of the rACC as a biomarker for response prediction to different antidepressant treatments. Ketamine-induced volumetric changes may be seen at later time points. (PsycInfo Database Record (c) 2021 APA, all rights reserved)",0,0,0,0,0,0,0,0,0,0,0,0,0,0,0,0,0,0,0,0,0,0,0,0,0,0,0,0,0,0,0,0,0,0,0,0,0,0,0,0,0,0,0,0,0,0,0,0,0,0,1,1,0,0,0,0,0,0,0,0,0,0,0,0,0,0,0,1,0,0,0,1,0,0,0,0,0,0,0,0,0,0,0,1,0,0,0,0,0,1,0,0,0,0,0,0,0,0,0,0,0,0,0,0,0,0,0,0,0,0,0,0,0,0,0,0,0,0,0,0,0,0,0,0,0,0,0,0
3598,"The Efficacy of Psilocybin in the Treatment of Depression and Anxiety: A Meta-Analysis.^
Background: The use of psychedelic compounds to treat psychiatric disorders has become a very significant topic of research over the past several years. Psilocybin has risen to prominence as one of the most studied among these psychedelic compounds. Multiple trials have already shown that it can be a safe and efficacious treatment for various medical conditions. This study intends to perform a meta-analysis of data reported in clinical trials studying psilocybin’s effect on depression and anxiety. Methods: Articles were searched, screened, and ultimately selected using predetermined inclusion criteria. Data was collected from commonly used psychometric tests that measured mood and anxiety symptoms. Effect sizes were calculated by comparing scores in these tests at baseline and control to experimental groups. Sub-group analysis was performed to assess psilocybin’s effect on depression and anxiety during short, medium, and long-term time frames. Results: Statistical significance was achieved in reducing depression and anxiety symptoms compared to controls in multiple subgroups. Heterogeneity of the effect sizes was calculated using an I2 value which showed low to moderate values. Multiple tools were used to assess publication bias, and none could be found. Conclusion: Although research on psilocybin continues to show promise, the evidence is still at a preliminary phase, and more trials need to be conducted with larger patient populations over longer periods for psilocybin to potentially be approved in a community setting.",0,0,0,0,0,0,0,0,0,0,0,0,0,0,0,0,0,0,0,0,0,0,0,0,0,0,0,0,0,0,0,0,0,0,0,0,0,0,0,0,0,0,0,0,0,0,0,0,0,0,1,1,1,0,0,0,0,0,0,0,0,0,0,0,0,0,0,0,0,0,0,1,0,0,0,0,0,0,0,0,0,0,0,1,0,0,0,0,0,1,0,0,0,0,0,0,0,0,0,0,0,0,0,0,0,0,0,0,0,0,0,0,0,0,0,0,0,0,0,0,0,0,0,0,0,0,0,0
3820,"Effect of baseline anxious depression on initial and sustained antidepressant response to ketamine.^
OBJECTIVE: Patients with anxious depression are typically more difficult to treat with monoaminergic antidepressants compared to those with nonanxious depression. Although novel research has shown that the N-methyl-D-aspartate (NMDA) receptor antagonist ketamine has rapidly acting, relatively sustained effects in treating depression, we predicted that, consistent with the existent literature on traditional antidepressants, patients with anxious depression would have a poorer antidepressant response. METHOD: Twenty-six inpatients with treatment-resistant major depressive disorder (MDD) (DSM-IV criteria) received a single infusion of ketamine (0.5 mg/kg over 40 minutes) from January 2006-March 2013 and were followed for 28 days. A post hoc analysis compared treatment response and relapse using the Montgomery-Asberg Depression Rating Scale (MADRS) in patients with anxious versus nonanxious depression. Anxious depression was defined as MDD plus a Hamilton Depression Rating Scale anxiety/somatization factor score ≥ 7. RESULTS: Both anxious and nonanxious depressed patients responded positively to ketamine. A linear mixed model controlling for baseline with the MADRS revealed a significant group main effect (P = .03) and group-by-time interaction (P = .01). Post hoc tests indicated that patients with anxious depression had significantly fewer depression symptoms compared to those with nonanxious depression at days 1 through 5, 9 through 12, 15 through 17, and 25, with no significant group differences in dissociative (P = .62) or psychotic (P = .41) side effects. Regarding responders, patients with anxious depression relapsed significantly later than those with nonanxious depression (median ± SE = 19.0 ± 17.9 vs 1.0 ± 0.0 days to relapse, respectively; χ² = 9.30; P = .002). CONCLUSIONS: Unexpectedly, patients with anxious depression responded better to ketamine than those with nonanxious depression, with longer time to relapse and no side effect differences. This finding gives promise for the role of novel glutamatergic medications for the treatment of those with anxious depression, a traditionally difficult-to-treat subgroup of depressed patients. TRIAL REGISTRATION: ClinicalTrials.gov identifier: NCT00088699.",0,0,0,0,0,0,0,0,0,0,0,0,0,0,0,0,0,0,0,0,0,0,0,0,0,0,0,0,0,0,0,0,0,0,0,0,0,0,0,0,0,0,0,0,0,0,0,0,0,0,1,1,1,0,0,0,0,0,0,0,0,0,0,0,0,0,0,0,0,0,0,1,0,0,0,0,0,0,0,0,0,0,0,1,0,0,0,0,0,1,0,0,0,0,0,0,0,0,0,0,0,0,0,0,0,0,0,0,0,0,0,0,0,0,0,0,0,0,0,0,0,0,0,0,0,0,0,0
4916,"A single intravenous administration of a sub-anesthetic ketamine dose during the perioperative period of cesarean section for preventing postpartum depression: A meta-analysis.^
The feasibility of intravenous ketamine administration during the perioperative period of cesarean section to prevent postpartum depression (PPD) has not been determined by meta-analysis. To evaluate the efficacy, safety and dose of prophylactic ketamine in offsetting PPD, we retrieved the following databases in English or Chinese from inception to December 2020: Pubmed, Embase, Web of Science, The Cochrane Library, CNKI, VIP and Wanfang. A total of 10 studies (9 RCTs and 1 retrospective study) were included with 2087 cases. Meta-analysis showed that in ketamine group, the score and the prevalence of PPD within 1 week postpartum were significantly reduced, whereas PPD score after 4 weeks postpartum showed no superiority. There was no significant difference in terms of total adverse events rate, although vomiting occurred more frequently in the ketamine group. In addition, we found that ketamine efficacy emerged at 0.5 mg/kg. By meta-regression, we observed that: (1) Age and BMI are negatively associated with mood response to ketamine. (2) An analgesic pump containing ketamine for continuous 48 h postpartum administration was more efficacious than an intravenous injection of ketamine during cesarean section. Current evidence shows ketamine could be efficacious and safe in the prophylactic management of PPD in women having a cesarean section.",0,0,0,0,0,0,0,0,0,0,0,0,0,0,0,0,0,0,0,0,0,0,0,0,0,0,0,0,0,0,0,0,0,0,0,0,0,0,0,0,0,0,0,0,0,0,0,0,0,0,1,1,0,0,0,0,0,0,0,0,0,0,0,0,0,0,0,0,0,1,0,1,0,0,0,0,0,0,0,0,0,0,0,1,0,0,0,0,0,1,0,0,0,0,0,0,0,0,0,0,0,0,0,0,0,0,0,0,0,0,0,0,0,0,0,0,0,0,0,0,0,0,0,0,0,0,0,0
5020,"[Analgesia-sedation for maxillo-facial surgery with midazolam-pentazocine and miazolam-ketamine. Clinical double-blind study of anxiety, analgesia, sedation and amnesia].^
Ketamine and midazolam, applied as intravenous medication for conscious sedation in day-case maxillo-facial surgery, has been proven to be superior to pentazocine and midazolam concerning cardiovascular parameters and respiratory depression. The aim of this study was to evaluate the effects of low-dose ketamine/midazolam on anxiety, analgesia, amnesia and subjective feelings. METHODS. 140 out-patients (ASA I) were randomly divided into four groups. The double-blind study was prospective. CONTROL GROUP: Local anaesthesia (LA), articaine 4% plus epinephrine 1:200,000 (n = 35); test group P/M: LA, additional pentazocine 0.40 mg/kg bw and midazolam 0.075 mg/kg bw i.v. (n = 35); test group K25/M: LA, additionally ketamine 0.25 mg/kg bw and midazolam 0.075 mg/kg bw i.v. (n = 35), test group K50/M: LA, additionally ketamine 0.5 mg/kg bw and midazolam 0.075 mg/kg bw i.v. (n = 35). LA was injected 3 min after application of the systemic medication in the test groups or application of a placebo (saline 0.9%) in the control group. Three further minutes later, operation was started. For evaluation questionnaires, visual analogue scales (VAS) and the state-trait anxiety inventory (STAI) were used. For testing retrograde and anterograde amnesia, acoustic sensations were delivered before application of the systemic medication (a Christmas carol) and during operation (the German national anthem). RESULTS. The control group and the test groups were comparable with regard to biological data, duration of operation, applied dosage of local anaesthetics and actual anxiety before operation. The patients in all test groups rated intraoperative anxiety as mild, in contrast to the control group. Nearly no pain sensation during the operation was remembered in all test groups. Retrograde amnesia was not found in any group. Complete anterograde amnesia was observed in all test groups with respect to the intraoperative sensation, but even in the control group 50% of the patients did not remember having heard the national anthem. As subjective feelings negative criteria were mainly reported in the control group, where as in all test groups positive sensations dominated. Dreams were reported mostly after the higher dosage of ketamine, but no patient experienced any unpleasant dreams. The clinical assessment of the different regimes were excellent for test groups P/M and K50/M, modest for the control group and test group K25/M. Postoperatively, patients of test group P/M were remarkably sedated, but no clinically relevant sedation or motor weakness were observed in the other groups. Postoperative pain sensations were rated more intense in all test groups than in the control group. In test groups P/M and K25/M an increasing pain level was recorded during the postoperative period, with the consequence of a higher demand rate for analgesics. CONCLUSIONS. Dental surgery can be performed safely with low-dose ketamine/midazolam. Compared to pentazocine/midazolam, the higher dosage of ketamine (0.5 mg/kg bw) showed identical results intraoperatively, but was superior during the postoperative period (vigilance), and thus may represent a suitable dosage. The lower dosage of ketamine resulted in worse operating conditions, but a dosage higher than 0.5 mg/kg bw might lead to unconscious sedation and might increase the frequency of unpleasant dreams.",0,0,0,0,0,0,0,0,0,0,0,0,0,0,0,0,0,0,0,0,0,0,0,0,0,0,0,0,0,0,0,0,0,0,0,0,0,0,0,0,0,0,0,0,0,0,0,0,0,0,0,0,0,0,0,0,0,0,0,0,1,0,0,0,0,0,0,0,0,0,0,1,0,0,0,0,0,0,0,0,0,0,1,0,1,0,0,0,0,0,0,0,0,0,0,0,0,0,0,0,0,0,0,0,0,0,0,0,0,0,0,0,0,0,0,0,0,0,0,0,0,0,0,0,0,0,0,0
5276,"Naltrexone but Not Ketanserin Antagonizes the Subjective, Cardiovascular, and Neuroendocrine Effects of Salvinorin-A in Humans.^
BACKGROUND: Salvinorin-A is a terpene found in the leaves of the plant Salvia divinorum. When administered to humans, salvinorin-A induces an intense but short-lasting modified state of awareness, sharing features with those induced by the classical serotonin-2A receptor agonist psychedelics. However, unlike substances such as psilocybin or mescaline, salvinorin-A shows agonist activity at the kappa-opioid receptor rather than at the serotonin-2A receptor. Here, we assessed the involvement of kappa-opioid receptor and serotonin-2A agonism in the subjective, cardiovascular, and neuroendocrine effects of salvinorin-A in humans. METHODS: We conducted a placebo-controlled, randomized, double-blind study with 2 groups of 12 healthy volunteers with experience with psychedelic drugs. There were 4 experimental sessions. In group 1, participants received the following treatment combinations: placebo+placebo, placebo+salvinorin-A, naltrexone+placebo, and naltrexone+salvinorin-A. Naltrexone, a nonspecific opioid receptor antagonist, was administered at a dose of 50mg orally. In group 2, participants received the treatment combinations: placebo+placebo, placebo+salvinorin-A, ketanserin+placebo, and ketanserin+salvinorin-A. Ketanserin, a selective serotonin-2A antagonist, was administered at a dose of 40mg orally. RESULTS: Inhalation of 1mg of vaporized salvinorin-A led to maximum plasma concentrations at 1 and 2 minutes after dosing. When administered alone, salvinorin-A severely reduced external sensory perception and induced intense visual and auditory modifications, increased systolic blood pressure, and cortisol and prolactin release. These effects were effectively blocked by naltrexone, but not by ketanserin. CONCLUSIONS: Results support kappa opioid receptor agonism as the mechanism of action underlying the subjective and physiological effects of salvinorin-A in humans and rule out the involvement of a serotonin-2A-mediated mechanism.",0,0,0,0,0,0,0,0,0,0,0,0,0,0,0,0,0,0,0,0,0,0,0,0,0,0,0,0,0,0,0,0,0,0,0,0,0,0,0,0,0,0,0,0,0,0,0,0,0,0,0,0,0,0,0,0,0,0,0,0,0,0,0,1,0,0,0,0,0,1,0,1,1,1,0,0,0,0,0,0,0,0,0,1,0,0,0,0,0,1,0,0,0,0,0,0,0,0,0,0,0,0,0,0,0,0,0,0,0,0,0,0,0,0,0,0,0,0,0,0,0,0,0,0,0,0,0,0
5380,"Sub-Acute Effects of Psilocybin on Empathy, Creative Thinking, and Subjective Well-Being.^
Creative thinking and empathy are crucial for everyday interactions and subjective well-being. This is emphasized by studies showing a reduction in these skills in populations where social interaction and subjective well-being are significantly compromised (e.g., depression). Anecdotal reports and recent studies suggest that a single administration of psilocybin can enhance such processes and could therefore be a potential treatment. However, it has yet to be assessed whether effects outlast acute intoxication. The present study aimed to assess the sub-acute effects of psilocybin on creative thinking, empathy, and well-being. Participants attending a psilocybin retreat completed tests of creative (convergent and divergent) thinking and empathy, and the satisfaction with life scale on three occasions: before ingesting psilocybin (N = 55), the morning after (N = 50), and seven days after (N = 22). Results indicated that psilocybin enhanced divergent thinking and emotional empathy the morning after use. Enhancements in convergent thinking, valence-specific emotional empathy, and well-being persisted seven days after use. Sub-acute changes in empathy correlated with changes in well-being. The study demonstrates that a single administration of psilocybin in a social setting may be associated with sub-acute enhancement of creative thinking, empathy, and subjective well-being. Future research should test whether these effects contribute to the therapeutic effects in clinical populations.",0,0,0,0,0,0,0,0,0,0,0,0,0,0,0,0,0,0,0,0,0,0,0,0,0,0,0,0,0,0,0,0,0,0,0,0,0,0,0,0,0,0,0,0,0,0,0,0,0,0,0,0,0,0,0,0,0,0,0,0,0,0,1,1,0,0,0,0,0,0,0,1,0,0,0,0,0,0,0,0,0,0,0,1,0,0,0,0,0,1,0,0,0,0,0,0,0,0,0,0,0,0,0,0,0,0,0,0,0,0,0,0,0,0,0,0,0,0,0,0,0,0,0,0,0,0,0,0
