5705,"D-serine plasma concentration is a potential biomarker of (R,S)-ketamine antidepressant response in subjects with treatment-resistant depression.^
RATIONALE: (R,S)-ketamine is a rapid and effective antidepressant drug that produces a response in two thirds of patients with treatment-resistant depression (TRD). The underlying biochemical differences between a (R,S)-ketamine responder (KET-R) and non-responder (KET-NR) have not been definitively identified but may involve serine metabolism. OBJECTIVES: The aim of the study was to examine the relationship between baseline plasma concentrations of D-serine and its precursor L-serine and antidepressant response to (R,S)-ketamine in TRD patients. METHODS: Plasma samples were obtained from 21 TRD patients at baseline, 60 min before initiation of the (R,S)-ketamine infusion. Patients were classified as KET-Rs (n = 8) or KET-NRs (n = 13) based upon the difference in Montgomery-Åsberg Depression Rating Scale (MADRS) scores at baseline and 230 min after infusion, with response defined as a ≥50 % decrease in MADRS score. The plasma concentrations of D-serine and L-serine were determined using liquid chromatography-mass spectrometry. RESULTS: Baseline D-serine plasma concentrations were significantly lower in KET-Rs (3.02 ± 0.21 μM) than in KET-NRs (4.68 ± 0.81 μM), p < 0.001. A significant relationship between baseline D-serine plasma concentrations and percent change in MADRS at 230 min was determined using a Pearson correlation, r = 0.77, p < 0.001, with baseline D-serine explaining 60 % of the variance in (R,S)-ketamine response. The baseline concentrations of L-serine (L-Ser) in KET-Rs were also significantly lower than those measured in KET-NRs (66.2 ± 9.6 μM vs 242.9 ± 5.6 μM, respectively; p < 0.0001). CONCLUSIONS: The results demonstrate that the baseline D-serine plasma concentrations were significantly lower in KET-Rs than in KET-NRs and suggest that this variable can be used to predict an antidepressant response following (R,S)-ketamine administration.",0,0,0,0,0,0,0,0,0,0,0,0,0,0,0,0,0,0,0,0,0,0,0,0,0,0,0,0,0,0,0,0,0,0,0,0,0,0,0,0,0,0,0,0,0,0,0,0,0,0,1,1,0,0,0,0,0,0,0,0,0,0,0,0,0,0,0,0,0,0,0,1,0,1,0,0,0,0,0,0,0,0,0,1,0,0,0,0,0,1,0,0,0,0,0,0,0,0,0,0,0,0,0,0,0,0,0,0,0,0,0,0,0,0,0,0,0,0,0,0,0,0,0,0,0,0,0,0
5968,"Effect of esketamine nasal spray on depressive symptoms in adults with severe major depressive disorder: a post hoc analysis of the aspire i and aspire ii studies.^
Background: ASPIRE I and ASPIRE II were 2 identically designed, global, double‐blind, placebo‐controlled phase 3 studies (NCT03039192, NCT03097133) designed to evaluate the efficacy and safety of esketamine (ESK) nasal spray vs placebo (PBO) nasal spray, given in the context of comprehensive standard of care (SoC; ie, hospitalization, initiation, or optimization of antidepressant therapy), in adults with major depressive disorder (MDD) who had active suicidal ideation with intent. These studies were the basis for the recent approval of ESK for the treatment of depressive symptoms in adults with MDD with acute suicidal ideation or behavior. To further understand the rapid effect of ESK +SoC vs PBO+SoC on depressive symptoms in patients with severe depression at baseline, we conducted a post hoc analysis of pooled data from ASPIRE I and ASPIRE II to examine changes in Montgomery‐Åsberg Depression Rating Scale (MADRS) total scores and Clinical Global Impression‐Severity of Suicidality‐Revised (CGI‐SS‐r) scores after ESK treatment. Methods: The ASPIRE I and II trials enrolled adults aged 18‐64 years with MDD confirmed by the Mini International Neuropsychiatric Interview and a minimum total MADRS score of >28 at baseline. Patients were randomized 1:1 to ESK 84 mg or PBO nasal spray twice weekly plus comprehensive SoC antidepressant treatment for 4 weeks. For this post hoc analysis, a subset of trial patients was identified as having severe depression per baseline total MADRS score >34 (Snaith Br J Psychiatry 1986). Change in MADRS total score was calculated from baseline to 4 hours post‐first dose, 24 hours post‐first dose, and predose on day 25 (ie, last day of double‐blind treatment phase). Differences between least squares mean (LSM) changes from baseline between groups in MADRS total score were examined using a mixed model for repeated measures. Percentages of subjects achieving response (ie, change in MADRS total score ≥50%) and remission (ie, MADRS total score ≤12) were also assessed using Cochran‐Mantel‐Haenszel tests. Generalized estimation equations were used to determine the relative odds of achieving a clinically meaningful improvement on the CGI‐SS‐r (≥1‐point decrease) scale with ESK+SoC vs PBO+SoC. A multiplicity adjustment procedure was not carried out. Results: Of 450 patients enrolled in the trials, 370 (82.2%) had severe MDD at baseline, as defined by MADRS score, and were included in this post hoc analysis (n=189, ESK+SoC; n=181, PBO +SoC). Demographic and psychiatric characteristics were similar between ESK+SoC and PBO+SoC groups at baseline (mean age: 40.3; 61.4% female). Mean (SD) MADRS total scores were 41.9 (4.62) and 42.5 (4.64), respectively. The ESK+SoC group had significantly greater decreases from baseline in MADRS total score vs the PBO+SoC group at 4 hours post‐first dose (‐12.6 vs ‐8.6; LSM difference [95% CI] ‐4.0 [‐5.9, ‐2.1]; P<0.001), at 24 hourspost‐first dose (‐16.4 vs ‐11.7; LSM difference [95% CI] ‐4.7 [‐6.9, ‐2.5]; P<0.001), and on day 25 (‐26.0 vs ‐22.8; LSM difference [95% CI] ‐3.2 [‐5.8, ‐0.7]; P=0.013). Significantly more patients in the ESK+SoC group vs PBO+SoC group attained response at 4 hours post‐first dose (24.5% vs 11.1%; P<0.001), at 24 hours post‐first dose (34.8% vs 22.4%; P=0.009), and on day 25 (76.7% vs 58.3%; P<0.001). The percentages of patients who attained remission were also greater in the ESK+SoC group vs PBO+SoC group at 4 hours post‐first dose (8.5% vs 2.8%; P=0.017), at 24 hours post‐first dose (18.2% vs 6.7%; P<0.001), and on day 25 (51.3% vs 36.1%; P=0.008). Patients in the ESK+SoC group were 78% more likely to experience a ≥1‐point decrease in CGI‐SS‐r score at 4 hours post‐first dose (odds ratio [95% CI] 1.78 [1.15, 2.74]; P=0.009) and 99% more likely at 24 hours post‐first dose (odds ratio [95% CI] 199 [1.24, 3.20]; P=0.005] than patients in the PBO+SoC group. Conclusions: Similar to findings from the ASPIRE global phase 3 clinical trial program to assess e ficacy of ESK+SoC vs PBO+SoC in reducing depressive symptoms in adults with moderate to severe MDD and suicidal ideation with intent, patients with severe MDD, as defined by MADRS total score >34, demonstrated significant improvement in depressive symptoms when treated with ESK +SoC compared with PBO+SoC as early as 4 hours after the first ESK dose. Improvements in depressive symptoms continued in favor of ESK+SoC treatment through study end of the doubleblind treatment phase. Additional analyses will be conducted to assess efficacy outcomes in patients with severe MDD defined through other validated instruments. ESK+SoC may provide an effective treatment of depressive symptoms with continued significant benefit for this population with challenging‐to‐treat depression. Reference: Snaith RP et al. Br J Psychiatry 1986;148:599‐601.",0,0,0,0,0,0,0,0,0,0,0,0,0,0,0,0,0,0,0,0,0,0,0,0,0,0,0,0,0,0,0,0,0,0,0,0,0,0,0,0,0,0,0,0,0,0,0,0,0,0,1,1,0,0,0,0,0,0,0,0,0,0,0,0,0,1,0,0,0,0,0,1,0,0,0,0,0,0,0,0,0,0,1,0,1,0,0,0,0,0,0,0,0,0,0,0,0,0,0,0,0,0,0,0,0,0,0,0,0,0,0,0,0,0,0,0,0,0,0,0,0,0,0,0,0,0,0,0
6000,"A Test of MDMA-Assisted Psychotherapy in People With Posttraumatic Stress Disorder.^
Posttraumatic stress disorder (PTSD) occurs in response to a traumatic event or events. It is most likely to occur following an event involving perceived personal threat, such as rape or physical assault. PTSD is clearly a public health problem that causes a great deal of suffering and accounts for a significant portion of health care costs. This study will examine whether two sessions of methylenedioxymethamphetamine (MDMA)‐assisted psychotherapy can be safely administered to participants with PTSD, and whether MDMA‐assisted psychotherapy, when compared with placebo‐assisted therapy, will reduce PTSD symptoms after each session and two months after the second session. MDMA is a substance possessing unique effects that make it well suited to intensive psychotherapy. MDMA has been hypothesized to represent a new class of drugs, called entactogens, that produce feelings of closeness to others, empathy, well being, and insightfulness. Currently, MDMA is scheduled (illegal) and cannot be used outside of research studies like this one. Anecdotal reports of therapy conducted before MDMA was made illegal suggest that MDMA‐assisted psychotherapy may benefit people with PTSD. This study will examine MDMA‐assisted psychotherapy in twenty people ages 18 to 70 with PTSD either related to crime victimization or combat, when combat‐related PTSD lasts no longer than five years, and that has not gotten better after psychotherapy and treatment with an SSRI (selective serotonin uptake inhibitor, such as Paxil). This study lasts three to four months. Participants attend up to fourteen (14) ordinary (non‐drug) psychotherapy sessions with the investigators as well as two eight hour long experimental (MDMA or placebo) sessions and one MDMA session. People taking part in this study cannot take any psychiatric medication during the study period. People will either get 125 mg MDMA or placebo ""by chance,"" as by coin‐toss, with twelve of twenty (60%) getting MDMA during each experimental session, and eight of twenty (40%) getting placebo. Two to two and a half hours later, if you and the investigators agree it is alright, you will take a second supplemental, dose of MDMA or placebo. The supplemental dose will be half the size of the first dose. The same investigators conducting non‐drug therapy sessions conduct the experimental sessions. All participants are required to stay the night at the clinic after each experimental session. Participants meet with the investigators for a non‐drug assisted therapy session the day after each experimental session. A third MDMA session in this placebo‐controlled stage of the study will only be for people who received MDMA in the first two sessions. PTSD symptoms are measured at the start of the study, four days after each experimental session, and finally two months after the second experimental session. People are tested on memory and problem solving when they first enter the study and again two months after the second experimental session. PTSD symptoms are measured to see whether there are any changes in symptoms during the study, and tests of thinking, memory and problem‐solving are meant to spot any changes that could be due to MDMA or MDMA‐assisted therapy. Participants who recieved MDMA who complete the final evaluation, and upon discussion with the investigators, will undergo a third MDMA session. The third session will happen approximately two months after the second experimental session This session is ""open label,"" meaning that they and the investigators will both know they are receiving MDMA. It will be followed by one psychotherapy session a day after this session and two additional psychotherapy sessions in the following weeks. PTSD symptoms will be measured again two months after the third MDMA session. Participants who received placebo and complete the final evaluation two months after the second experimental procedure will be given an opportunity to take part in an open‐label continuation of the study where they will receive an initial dose of 125 mg MDMA and a supplemental dose of 62.5 mg MDMA in up to three experimental sessions scheduled three to five weeks apart. Participants in this open‐label continuation will act as their own controls. The open‐label continuation lasts three months and will involve nine more visits with the investigators, including the two experimental sessions.",0,0,0,0,0,0,0,0,0,0,0,0,0,0,0,0,0,0,0,0,0,0,0,0,0,0,0,0,0,0,0,0,0,0,0,0,0,0,0,0,0,0,0,0,0,0,0,0,0,0,1,0,0,1,0,0,0,0,0,0,0,0,0,0,0,0,0,0,0,0,0,1,0,0,0,0,0,0,0,0,0,0,1,0,0,0,0,0,0,1,0,0,0,0,0,0,0,0,0,0,0,0,0,0,0,0,0,0,0,0,0,0,0,0,0,0,0,0,0,0,0,0,0,0,0,0,0,0
6015,"Interaction Between Duloxetine and 3,4-Methylenedioxymethamphetamine (MDMA, Ecstasy).^
3,4‐methylenedioxymethamphetamine (MDMA, ""ecstasy"") is widely used by young people for its euphoric effects. MDMA releases serotonin (5‐HT), norepinephrine (NE), and dopamine through an interaction with the corresponding presynaptic monoamine uptake transporter. 5‐HT transport inhibitors block MDMA‐induced 5‐HT release in vitro or in animals and also attenuate the subjective and cardiovascular response to MDMA in humans. NE transport inhibitors similarly prevent the MDMA‐induced release of NE in cell assays and attenuate behavioral effects of MDMA in animals. Effects of the NE transporter inhibitor reboxetine on the response to MDMA in humans are currently investigated. Here we suggest evaluating effects of pretreatment with the combined 5‐HT and NE transport blocker duloxetine on the pharmacodynamics and pharmacokinetics of MDMA. The study will use a randomized double‐blind cross‐over design with four experimental sessions. Duloxetine (120 mg) or placebo will be administered 16 h and 4 h before the administration of MDMA (125 mg) or placebo to 16 healthy volunteers. Subjective and cardiovascular responses and plasma samples for pharmacokinetics will be repeatedly assessed throughout the experiments.",0,0,0,0,0,0,0,0,0,0,0,0,0,0,0,0,0,0,0,0,0,0,0,0,0,0,0,0,0,0,0,0,0,0,0,0,0,0,0,0,0,0,0,0,0,0,0,0,0,0,0,0,0,0,0,0,0,0,0,0,0,0,0,1,0,0,0,0,0,1,0,1,0,1,0,0,0,0,0,0,0,0,1,0,0,0,0,0,0,1,0,0,0,0,0,0,0,0,0,0,0,0,0,0,0,0,0,0,0,0,0,0,0,0,0,0,0,0,0,0,0,0,0,0,0,0,0,0
6044,"Psilocybin-facilitated Smoking Cessation Treatment: a Pilot Study.^
One of the most promising lines of investigation for the therapeutic use of hallucinogens in the 1960s and 1970s was in the treatment of drug dependence. We propose to examine psilocybin administration combined with a structured smoking cessation treatment program in nicotine dependent individuals in order to provide preliminary data on the efficacy of this combined treatment for smoking cessation. Prior work in our laboratory has shown that under carefully prepared and supportive conditions, psilocybin administration can facilitate highly salient experiences with enduring personal meaning and spiritual significance (Griffiths et al., 2006, 2008). It is plausible that embedding such highly meaningful experiences into a drug dependence cessation attempt may provide an enduring motivation for remaining abstinent. Cigarette smoking is a good model system for studying drug dependence because users are less likely to be challenged by the many social and economic impairments that often accompany dependence on other drugs such as cocaine, heroin, or alcohol. More specifically, we propose to conduct a randomized controlled comparative efficacy study in which either psilocybin or transdermal nicotine patch are administered under highly supportive conditions to individuals who are nicotine‐dependent cigarette smokers, who have had multiple unsuccessful quit attempts, and who continue to desire to quit smoking. Other than nicotine dependence, participants will be healthy. Fifteen participants have already completed a preliminary open‐label pilot‐study with no control condition. Eighty additional participants will be enrolled and randomized to either psilocybin (n=40), or nicotine patch (n=40) treatment. Participants will receive a 13‐week course of cognitive behavioral therapy for smoking cessation, with Target Quit Date set for week 5. After several preparation meetings with study monitors, participants will have either a single day‐long psilocybin session using a high dose (30 mg/70 kg), or a standard 8 to 10‐week course of nicotine patch treatment. Participant smoking status will be assessed repeatedly for 8 weeks after the Target Quit Date, including biological verification of smoking status through breath and urine samples. Smoking status will also be assessed at three follow up sessions approximately 3, 6, and 12 months after the Target Quit Date. Additionally, 50 of these participants (25 per treatment condition) will undergo MRI scanning before and after Target Quit Date to assess the brain‐based mechanisms associated with these treatments. Individuals assigned to the nicotine patch study treatment condition will be eligible to undergo an optional high dose psilocybin session after completing the 6‐month follow‐up meeting.",0,0,0,0,0,0,0,0,0,0,0,0,0,0,0,0,0,0,0,0,0,0,0,0,0,0,0,0,0,0,0,0,0,0,0,0,0,0,0,0,0,0,0,0,0,0,0,0,0,0,1,0,0,0,0,1,0,0,0,0,0,0,0,0,0,0,1,1,0,0,0,0,0,1,0,0,0,0,0,0,0,0,1,0,0,0,0,0,0,1,0,0,0,0,0,0,0,0,0,0,0,0,0,0,0,0,0,0,0,0,0,0,0,0,0,0,0,0,0,0,0,0,0,0,0,0,0,0
6103,"A Multi-Site Study of MDMA-Assisted Psychotherapy for PTSD.^
PTSD is a serious debilitating disorder that negatively impacts a person's daily life. PTSD is a stress‐related psychiatric condition that may occur following a traumatic event such as war, disaster, sexual abuse, violence, terrorism, and accidents. PTSD negatively impacts a person's daily life, resulting in relationship difficulties, difficulty in finding and maintaining a job, reduced cognitive and psychosocial functioning, substance abuse, high‐cost healthcare use, and increased depression and suicide risk. Available PTSD treatments, including medications and therapy, effectively treat only a fraction of people who try them for adequate dose and duration. People with PTSD can be treated with psychotherapies and pharmacotherapies. In the past decade, there has been a growing amount of research into medications and other methods that may augment the effectiveness of psychotherapy for PTSD 3,4‐methylenedioxymethamphetamine (MDMA) is a drug that releases serotonin, norepinephrine and dopamine in the brain and indirectly increases levels of the neurohormones oxytocin, arginine vasopressin and cortisol. The combined neurobiological effects of MDMA increase compassion, reduce defenses and fear of emotional injury, and enhance communication and introspection. MDMA produces anxiolytic and prosocial effects, which counteract avoidance and hyperarousal in the context of therapy. A combined treatment of MDMA and psychotherapy may be especially useful for treating PTSD. This multi‐site, double‐blind, randomized Phase 3 study assesses the efficacy and safety of MDMA‐assisted psychotherapy versus psychotherapy with placebo control in participants diagnosed with at least severe posttraumatic stress disorder (PTSD). The study will be conducted in N ≈ 100 participants. Participants will be enrolled in one of two groups at a 1:1 ratio. A flexible dose of MDMA or placebo, followed by a supplemental half‐dose unless contraindicated, is administered during the Treatment Period with manualized psychotherapy in three monthly Experimental Sessions. This 12‐week Treatment Period is preceded by three Preparatory Sessions. During the Treatment Period, each Experimental Session is followed by three Integrative Sessions of non‐drug psychotherapy. The Primary Outcome measure is change in Clinician Administered PTSD Scale for DSM 5 (CAPS‐5) from Baseline. Exploratory measures will address specific symptoms, or behavior that is sometimes related to PTSD. Drug safety will be assessed by measuring blood pressure, heart rate and body temperature during experimental sessions, collecting adverse events and measuring suicidal thoughts or behaviors with the Columbia Suicide Severity Rating Scale (CSSRS). This study will compare the effects of three manualized Experimental Sessions of psychotherapy supported by assisted by flexible doses of MDMA versus placebo. Initial doses per Experimental Session include 80 mg or 120 mg of MDMA compounded with mannitol and magnesium stearate or placebo alone (mannitol and magnesium stearate), followed 1.5 to 2 hours later by a supplemental half‐dose (40 or 60 mg). Total amounts of MDMA to be administered per Experimental Session range from 80 mg to 180",0,0,0,0,0,0,0,0,0,0,0,0,0,0,0,0,0,0,0,0,0,0,0,0,0,0,0,0,0,0,0,0,0,0,0,0,0,0,0,0,0,0,0,0,0,0,0,0,0,0,1,0,0,1,0,0,0,0,0,0,0,0,0,0,0,1,0,0,0,1,0,1,0,0,0,0,0,0,0,0,1,0,0,0,0,0,0,0,0,1,0,0,0,0,0,0,0,0,0,0,0,0,0,0,0,0,0,0,0,0,0,0,0,0,0,0,0,0,0,0,0,0,0,0,0,0,0,0
6221,"Assessing SLS-002 (Intranasal Racemic Ketamine) in Adults With Major Depressive Disorder at Imminent Risk of Suicide.^
This Phase 2, multicenter, 2‐part study in adult subjects diagnosed with MDD at imminent risk of suicide will evaluate the efficacy, safety, and tolerability of intranasally (IN) administered SLS‐002 (IN spray) plus SOC. In Part 1, 16 subjects will receive open‐label SLS‐002 (90 mg). Part 2 of the study is double‐blind and 220 subjects will be randomized 1:1 to receive either SLS‐002 (90 mg) or matching placebo. The Johns Hopkins Hospital Department of Psychiatry and Behavioral Sciences will be working with Seelos Therapeutics on Part 2 of the study with an estimated enrollment of 10 participants. After admission to the emergency room or hospital, each subject will participate in a 1‐ to 2‐day screening phase, a 16‐day treatment phase including standard of care during which study drug will be administered 2 times per week for a total of 5 doses, and a 2‐week safety follow‐up phase for a total of up to 5 weeks of study participation. Subjects will be treated as inpatients for approximately 7 days (including screening), and assuming the subject meets readiness for discharge criteria, will be discharged on Day 6 to continue the trial as outpatients, provided it is clinically appropriate to do so.",0,0,0,0,0,0,0,0,0,0,0,0,0,0,0,0,0,0,0,0,0,0,0,0,0,0,0,0,0,0,0,0,0,0,0,0,0,0,0,0,0,0,0,0,0,0,0,0,0,0,1,1,0,0,0,0,0,0,0,0,0,0,0,0,0,0,0,0,0,0,0,1,0,0,0,0,0,0,0,0,0,0,1,0,0,0,0,0,0,1,0,0,0,0,0,0,0,0,0,0,0,0,0,0,0,0,0,0,0,0,0,0,0,0,0,0,0,0,0,0,0,0,0,0,0,0,0,0
6855,"Psychiatric safety of ketamine in psychopharmacology research.^
RATIONALE: A growing number of investigators are studying ketamine effects in healthy human subjects, but concerns remain about its safety as a research tool. Therefore, it is timely to revisit the safety of subanesthetic doses of ketamine in experimental psychopharmacology studies. OBJECTIVE: To report on the safety of laboratory studies with subanesthetic doses of ketamine in healthy humans using an existing dataset. MATERIALS AND METHODS: Medically healthy subjects with no personal or familial Axis I psychotic spectrum disorders were administered subanesthetic doses of ketamine by intravenous infusion in a series of clinical investigations from 1989 to 2005. The safety of ketamine administration was monitored in these subjects. RESULTS: Four hundred and fifty subjects received at least one dose of active ketamine. Eight hundred and thirty three active ketamine and 621 placebo infusions were administered. Ten adverse mental status events were documented in nine subjects/infusions that were deemed related to ketamine administration (2% of subjects, 1.45% of infusions). All but one adverse reaction resolved by the end of the test session. The side effects in the remaining individual were no longer clinically significant within 4 days of the test session. No residual sequelae were observed. CONCLUSION: Ketamine administration at subanesthetic doses appears to present an acceptable level of risk for carefully screened populations of healthy human subjects in the context of clinical research programs that intensively monitor subjects throughout their study participation.",0,0,0,0,0,0,0,0,0,0,0,0,0,0,0,0,0,0,0,0,0,0,0,0,0,0,0,0,0,0,0,0,0,0,0,0,0,0,0,0,0,0,0,0,0,0,0,0,0,0,0,0,0,0,0,0,0,0,0,0,0,0,0,0,0,0,0,0,0,0,0,1,0,0,0,0,0,0,0,0,0,0,0,1,0,0,0,0,0,1,0,0,0,0,0,0,0,0,0,0,0,0,0,0,0,0,0,0,0,0,0,0,0,0,0,0,0,0,0,0,0,0,0,0,0,0,0,0
